{
  "schemaVersion": "situation-prompt-representation-config-v1",
  "selectedVersion": "compact-v1",
  "candidateMaxUtf8Bytes": 8192,
  "candidateMaxUnicodeCharacters": 4096,
  "percentileMethod": "nearest-rank",
  "expanded": {
    "version": "expanded-v1",
    "systemText": "根据结构化局势和权威证据生成简短、忠实的中文局势说明。只引用 allowedEvidenceIds 中的证据，不预测胜负，不提供战术指令。",
    "inputPrefix": "<situation-input-expanded-v1>",
    "outputPrefix": "<situation-output>"
  },
  "compact": {
    "version": "compact-v1",
    "systemText": "根据 compact-v1 结构化局势和权威证据生成简短、忠实的中文局势说明。短键由冻结配置定义；只引用 ae 中的证据，不预测胜负，不提供战术指令。",
    "inputPrefix": "<situation-input-compact-v1>",
    "outputPrefix": "<situation-output>"
  },
  "shortKeys": {
    "alive": "al",
    "allowedEvidenceIds": "ae",
    "analysisRuleVersion": "av",
    "area": "aa",
    "armor": "am",
    "bomb": "bo",
    "carrier": "ca",
    "code": "co",
    "confidence": "cf",
    "contactRisk": "ck",
    "contestedRegions": "cr",
    "dataQuality": "dq",
    "defuser": "de",
    "defuserCount": "dc",
    "effects": "ef",
    "elapsedSeconds": "es",
    "endTick": "ek",
    "equipmentValue": "eq",
    "evidence": "ev",
    "evidenceIds": "ei",
    "facts": "f",
    "field": "fi",
    "formation": "fm",
    "geometry": "ge",
    "geometryVersion": "gv",
    "health": "hp",
    "helmetCount": "hc",
    "highlights": "hl",
    "history": "hi",
    "isolatedSide": "is",
    "map": "mp",
    "money": "mo",
    "ownerSide": "os",
    "phase": "ph",
    "players": "ps",
    "position": "po",
    "pressure": "pr",
    "radius": "ra",
    "ref": "rf",
    "region": "rg",
    "regionOccupancy": "oc",
    "regions": "re",
    "remainingSeconds": "rs",
    "round": "ro",
    "scene": "s",
    "sceneBuilderVersion": "bv",
    "schemaVersion": "sv",
    "secondsToDefuse": "bd",
    "secondsToExplosion": "bx",
    "severity": "se",
    "side": "sd",
    "site": "si",
    "sites": "ss",
    "slot": "sl",
    "spatialAdvantage": "sa",
    "startTick": "sk",
    "state": "st",
    "summaryZh": "sz",
    "teams": "ts",
    "textZh": "zh",
    "tick": "tk",
    "tickRate": "tr",
    "totalHealth": "th",
    "trajectory": "tj",
    "type": "ty",
    "uncertainties": "un",
    "utilities": "us",
    "value": "va",
    "velocity": "ve",
    "yaw": "yw"
  }
}
